{
  "id": "namespace:work-product-component--WellPressureTestRawMeasurement:0c4b5c5b-32cd-57d2-b6a7-bbff6801fb09",
  "kind": "osdu:wks:work-product-component--WellPressureTestRawMeasurement:1.1.0",
  "version": 1562066009929332,
  "acl": {
    "owners": [
      "someone@company.com"
    ],
    "viewers": [
      "someone@company.com"
    ]
  },
  "legal": {
    "legaltags": [
      "Example legaltags"
    ],
    "otherRelevantDataCountries": [
      "US"
    ],
    "status": "compliant"
  },
  "tags": {
    "NameOfKey": "String value"
  },
  "createTime": "2020-12-16T11:46:20.163Z",
  "createUser": "some-user@some-company-cloud.com",
  "modifyTime": "2020-12-16T11:52:24.477Z",
  "modifyUser": "some-user@some-company-cloud.com",
  "ancestry": {
    "parents": []
  },
  "meta": [
    {
      "kind": "Unit",
      "name": "m",
      "persistableReference": "{\"abcd\":{\"a\":0.0,\"b\":1.0,\"c\":1.0,\"d\":0.0},\"symbol\":\"m\",\"baseMeasurement\":{\"ancestry\":\"L\",\"type\":\"UM\"},\"type\":\"UAD\"}",
      "unitOfMeasureID": "namespace:reference-data--UnitOfMeasure:m:",
      "propertyNames": [
        "Measurements[].PressurePointMeasuredDepth",
        "Measurements[].PressureTestTopMeasuredDepth",
        "Measurements[].PressureTestBottomMeasuredDepth",
        "Measurements[0].DepthReference.VerticalMeasurement"
      ]
    }
  ],
  "data": {
    "ResourceHomeRegionID": "namespace:reference-data--OSDURegion:AWSEastUSA:",
    "ResourceHostRegionIDs": [
      "namespace:reference-data--OSDURegion:AWSEastUSA:"
    ],
    "ResourceCurationStatus": "namespace:reference-data--ResourceCurationStatus:Created:",
    "ResourceLifecycleStatus": "namespace:reference-data--ResourceLifecycleStatus:Loading:",
    "Source": "Example Data Source",
    "ExistenceKind": "namespace:reference-data--ExistenceKind:Prototype:",
    "Datasets": [
      "namespace:dataset--AnyDataset:SomeUniqueAnyDatasetID:"
    ],
    "DDMSDatasets": [
      "urn://wddms-3/uuid:20840361-adc0-4842-999b-5639bd07bb38",
      "eml://rddms-1/dataspace('demo/Volve')/resqml20.obj_ContinuousProperty(1615d8d2-2a2d-482c-885e-14225b89e90c)"
    ],
    "Artefacts": [
      {
        "RoleID": "namespace:reference-data--ArtefactRole:AdaptedContent:",
        "ResourceKind": "namespace:source_name:group_type--IndividualType:0.0.0",
        "ResourceID": "namespace:dataset--AnyDataset:SomeUniqueAnyDatasetID:"
      }
    ],
    "IsExtendedLoad": true,
    "IsDiscoverable": true,
    "TechnicalAssurances": [
      {
        "TechnicalAssuranceTypeID": "namespace:reference-data--TechnicalAssuranceType:Trusted:",
        "Reviewers": [
          {
            "RoleTypeID": "namespace:reference-data--ContactRoleType:AccountOwner:",
            "DataGovernanceRoleTypeID": "namespace:reference-data--DataGovernanceRoleType:SME:",
            "WorkflowPersonaTypeID": "namespace:reference-data--WorkflowPersonaType:SeismicProcessor:",
            "OrganisationID": "namespace:master-data--Organisation:SomeUniqueOrganisationID:",
            "Name": "John Smith"
          }
        ],
        "AcceptableUsage": [
          {
            "WorkflowUsageTypeID": "namespace:reference-data--WorkflowUsageType:SeismicProcessing:",
            "WorkflowPersonaTypeID": "namespace:reference-data--WorkflowPersonaType:SeismicProcessor:",
            "DataQualityRuleSetID": "namespace:reference-data--DataQualityRuleSet:SeismicProcessingQCRuleSet:",
            "DataQualityID": "namespace:work-product-component--DataQuality:6a433d16-07c8-4f4d-9ddc-5608e2ec4234:1562066077849221",
            "ValueChainStatusTypeID": "namespace:reference-data--ValueChainStatusType:Exploration:"
          }
        ],
        "UnacceptableUsage": [
          {
            "WorkflowUsageTypeID": "namespace:reference-data--WorkflowUsageType:SeismicInterpretation:",
            "WorkflowPersonaTypeID": "namespace:reference-data--WorkflowPersonaType:SeismicInterpreter:",
            "DataQualityRuleSetID": "namespace:reference-data--DataQualityRuleSet:SeismicInterpretationQCRuleSet:",
            "DataQualityID": "namespace:work-product-component--DataQuality:d79bf97c-ff7c-4b82-89b5-c88520c15017:1562066009929332",
            "ValueChainStatusTypeID": "namespace:reference-data--ValueChainStatusType:FieldDevelopment:"
          }
        ],
        "EffectiveDate": "2020-02-13",
        "Comment": "This is free form text from reviewer, e.g. restrictions on use"
      }
    ],
    "NameAliases": [
      {
        "AliasName": "Example AliasName",
        "AliasNameTypeID": "namespace:reference-data--AliasNameType:RegulatoryIdentifier:",
        "DefinitionOrganisationID": "namespace:master-data--Organisation:SomeUniqueOrganisationID:",
        "EffectiveDateTime": "2020-02-13T09:13:15.55Z",
        "TerminationDateTime": "2020-02-13T09:13:15.55Z"
      }
    ],
    "Name": "Example Name",
    "Description": "Example Description",
    "CreationDateTime": "2020-02-13T09:13:15.55Z",
    "Tags": [
      "Example Tags"
    ],
    "SpatialPoint": {
      "SpatialLocationCoordinatesDate": "2020-02-13T09:13:15.55Z",
      "QuantitativeAccuracyBandID": "namespace:reference-data--QuantitativeAccuracyBand:Length.LessThan1m:",
      "QualitativeSpatialAccuracyTypeID": "namespace:reference-data--QualitativeSpatialAccuracyType:Assumed:",
      "CoordinateQualityCheckPerformedBy": "Example CoordinateQualityCheckPerformedBy",
      "CoordinateQualityCheckDateTime": "2020-02-13T09:13:15.55Z",
      "CoordinateQualityCheckRemarks": [
        "Example CoordinateQualityCheckRemarks"
      ],
      "AsIngestedCoordinates": {
        "type": "AnyCrsFeatureCollection",
        "CoordinateReferenceSystemID": "namespace:reference-data--CoordinateReferenceSystem:BoundProjected:EPSG::32021_EPSG::15851:",
        "VerticalCoordinateReferenceSystemID": "namespace:reference-data--CoordinateReferenceSystem:Vertical:EPSG::5714:",
        "VerticalUnitID": "namespace:reference-data--UnitOfMeasure:m:",
        "persistableReferenceCrs": "{\"authCode\":{\"auth\":\"OSDU\",\"code\":\"32021079\"},\"lateBoundCRS\":{\"authCode\":{\"auth\":\"EPSG\",\"code\":\"32021\"},\"name\":\"NAD_1927_StatePlane_North_Dakota_South_FIPS_3302\",\"type\":\"LBC\",\"ver\":\"PE_10_9_1\",\"wkt\":\"PROJCS[\\\"NAD_1927_StatePlane_North_Dakota_South_FIPS_3302\\\",GEOGCS[\\\"GCS_North_American_1927\\\",DATUM[\\\"D_North_American_1927\\\",SPHEROID[\\\"Clarke_1866\\\",6378206.4,294.9786982]],PRIMEM[\\\"Greenwich\\\",0.0],UNIT[\\\"Degree\\\",0.0174532925199433]],PROJECTION[\\\"Lambert_Conformal_Conic\\\"],PARAMETER[\\\"False_Easting\\\",2000000.0],PARAMETER[\\\"False_Northing\\\",0.0],PARAMETER[\\\"Central_Meridian\\\",-100.5],PARAMETER[\\\"Standard_Parallel_1\\\",46.18333333333333],PARAMETER[\\\"Standard_Parallel_2\\\",47.48333333333333],PARAMETER[\\\"Latitude_Of_Origin\\\",45.66666666666666],UNIT[\\\"Foot_US\\\",0.3048006096012192],AUTHORITY[\\\"EPSG\\\",32021]]\"},\"name\":\"NAD27 * OGP-Usa Conus / North Dakota CS27 South zone [32021,15851]\",\"singleCT\":{\"authCode\":{\"auth\":\"EPSG\",\"code\":\"15851\"},\"name\":\"NAD_1927_To_WGS_1984_79_CONUS\",\"type\":\"ST\",\"ver\":\"PE_10_9_1\",\"wkt\":\"GEOGTRAN[\\\"NAD_1927_To_WGS_1984_79_CONUS\\\",GEOGCS[\\\"GCS_North_American_1927\\\",DATUM[\\\"D_North_American_1927\\\",SPHEROID[\\\"Clarke_1866\\\",6378206.4,294.9786982]],PRIMEM[\\\"Greenwich\\\",0.0],UNIT[\\\"Degree\\\",0.0174532925199433]],GEOGCS[\\\"GCS_WGS_1984\\\",DATUM[\\\"D_WGS_1984\\\",SPHEROID[\\\"WGS_1984\\\",6378137.0,298.257223563]],PRIMEM[\\\"Greenwich\\\",0.0],UNIT[\\\"Degree\\\",0.0174532925199433]],METHOD[\\\"NADCON\\\"],PARAMETER[\\\"Dataset_conus\\\",0.0],OPERATIONACCURACY[5.0],AUTHORITY[\\\"EPSG\\\",15851]]\"},\"type\":\"EBC\",\"ver\":\"PE_10_9_1\"}",
        "persistableReferenceVerticalCrs": "{\"authCode\":{\"auth\":\"EPSG\",\"code\":\"5714\"},\"name\":\"MSL_Height\",\"type\":\"LBC\",\"ver\":\"PE_10_9_1\",\"wkt\":\"VERTCS[\\\"MSL_Height\\\",VDATUM[\\\"Mean_Sea_Level\\\"],PARAMETER[\\\"Vertical_Shift\\\",0.0],PARAMETER[\\\"Direction\\\",1.0],UNIT[\\\"Meter\\\",1.0],AUTHORITY[\\\"EPSG\\\",5714]]\"}",
        "persistableReferenceUnitZ": "{\"scaleOffset\":{\"scale\":1.0,\"offset\":0.0},\"symbol\":\"m\",\"baseMeasurement\":{\"ancestry\":\"Length\",\"type\":\"UM\"},\"type\":\"USO\"}",
        "features": [
          {
            "type": "AnyCrsFeature",
            "properties": {},
            "geometry": {
              "type": "AnyCrsPoint",
              "coordinates": [
                12345.6,
                12345.6
              ],
              "bbox": [
                12345.6,
                12345.6,
                12345.6,
                12345.6
              ]
            },
            "bbox": [
              12345.6,
              12345.6,
              12345.6,
              12345.6
            ]
          }
        ],
        "bbox": [
          12345.6,
          12345.6,
          12345.6,
          12345.6
        ]
      },
      "Wgs84Coordinates": {
        "type": "FeatureCollection",
        "features": [
          {
            "type": "Feature",
            "properties": {},
            "geometry": {
              "type": "Point",
              "coordinates": [
                12345.6,
                12345.6
              ],
              "bbox": [
                12345.6,
                12345.6,
                12345.6,
                12345.6
              ]
            },
            "bbox": [
              12345.6,
              12345.6,
              12345.6,
              12345.6
            ]
          }
        ],
        "bbox": [
          12345.6,
          12345.6,
          12345.6,
          12345.6
        ]
      },
      "AppliedOperations": [